<?xml version="1.0" encoding="UTF-8"?>
<cs:Map xmlns:xlink="http://www.w3.org/1999/xlink"
    xmlns:cs="http://www.imvertor.org/metamodels/conceptualschemas/model/v20181210"
    xmlns:cs-ref="http://www.imvertor.org/metamodels/conceptualschemas/model-ref/v20181210"
    xmlns:xsi="http://www.w3.org/2001/XMLSchema-instance"
    xmlns:xi="http://www.w3.org/2001/XInclude"
    xsi:schemaLocation="http://www.imvertor.org/metamodels/conceptualschemas/model/v20181210 
    ../../../etc/xsd/ConceptualSchema/root/model/v20181210/ConceptualSchemas_Model_v1_0.xsd">
   
    <cs:id>CITYGML</cs:id>
    <cs:namespace>http://www.opengis.net/citygml</cs:namespace>
    <cs:location>http://schemas.opengis.net/citygml</cs:location>
    <cs:phase>3</cs:phase>
    <cs:version>2.0</cs:version>
    <cs:release>20120201</cs:release>
    <cs:forSchema>
        <cs-ref:ConceptualSchemaRef xlink:href="#CITYGML"/>
    </cs:forSchema>
    <cs:owner>OGC</cs:owner>
    <cs:constructs>
        <cs:Construct>
            <cs:name>ReliefFeature</cs:name>
            <cs:sentinel>false</cs:sentinel>
            <cs:xsdTypes>
                <cs:XsdType>
                    <cs:name>ReliefFeature</cs:name>
                    <cs:asAttribute>ReliefFeatureType</cs:asAttribute>
                    <cs:asAttributeDesignation>complextype</cs:asAttributeDesignation>
                    <cs:primitive>false</cs:primitive>
                    <cs:hasNilreason>false</cs:hasNilreason>
                </cs:XsdType>
            </cs:xsdTypes>
        </cs:Construct>
        <cs:Construct>
            <cs:name>Railway</cs:name>
            <cs:sentinel>false</cs:sentinel>
        </cs:Construct>
        <cs:Construct>
            <cs:name>CityFurniture</cs:name>
            <cs:sentinel>false</cs:sentinel>
        </cs:Construct>
        <cs:Construct>
            <cs:name>BridgeConstructionElement</cs:name>
            <cs:sentinel>false</cs:sentinel>
        </cs:Construct>
        <cs:Construct>
            <cs:name>TrafficArea</cs:name>
            <cs:sentinel>false</cs:sentinel>
        </cs:Construct>
        <cs:Construct>
            <cs:name>LandUse</cs:name>
            <cs:sentinel>false</cs:sentinel>
        </cs:Construct>
        <cs:Construct>
            <cs:name>_CityObject</cs:name>
            <cs:sentinel>false</cs:sentinel>
        </cs:Construct>
        <cs:Construct>
            <cs:name>WaterBody</cs:name>
            <cs:sentinel>false</cs:sentinel>
        </cs:Construct>
        <cs:Construct>
            <cs:name>AuxiliaryTrafficArea</cs:name>
            <cs:sentinel>false</cs:sentinel>
        </cs:Construct>
        <cs:Construct>
            <cs:name>BuildingInstallation</cs:name>
            <cs:sentinel>false</cs:sentinel>
        </cs:Construct>
        <cs:Construct>
            <cs:name>BuildingPart</cs:name>
            <cs:sentinel>false</cs:sentinel>
        </cs:Construct>
        <cs:Construct>
            <cs:name>_Site</cs:name>
            <cs:sentinel>false</cs:sentinel>
        </cs:Construct>
        <cs:Construct>
            <cs:name>SolitaryVegetationObject</cs:name>
            <cs:sentinel>false</cs:sentinel>
        </cs:Construct>
        <cs:Construct>
            <cs:name>TunnelPart</cs:name>
            <cs:sentinel>false</cs:sentinel>
        </cs:Construct>
        <cs:Construct>
            <cs:name>PlantCover</cs:name>
            <cs:sentinel>false</cs:sentinel>
        </cs:Construct>
        <cs:Construct>
            <cs:name>ImplicitGeometry</cs:name>
            <cs:sentinel>false</cs:sentinel>
        </cs:Construct>

    </cs:constructs>
    
</cs:Map>