<?xml version="1.0" encoding="UTF-8"?>
<cs:Map xmlns:xlink="http://www.w3.org/1999/xlink"
    xmlns:cs="http://www.imvertor.org/metamodels/conceptualschemas/model/v20181210"
    xmlns:cs-ref="http://www.imvertor.org/metamodels/conceptualschemas/model-ref/v20181210"
    xmlns:xsi="http://www.w3.org/2001/XMLSchema-instance"
    xmlns:xi="http://www.w3.org/2001/XInclude"
    xsi:schemaLocation="http://www.imvertor.org/metamodels/conceptualschemas/model/v20181210 
    ../../../etc/xsd/ConceptualSchema/root/model/v20181210/ConceptualSchemas_Model_v1_0.xsd">
   
    <cs:id>MIM11</cs:id>
    <cs:namespace>http://www.geonovum.nl/MIM11</cs:namespace>
    <cs:location>http://schemas.geonovum.nl/mim11.xsd</cs:location><!-- bogus not used for schema generator -->
    <cs:phase>3</cs:phase>
    <cs:version>1.0.0</cs:version>
    <cs:release>20200820</cs:release>
    <cs:forSchema>
        <cs-ref:ConceptualSchemaRef xlink:href="#MIM11"/>
    </cs:forSchema>
    <cs:constructs>
        <cs:Construct>
            <cs:name>CharacterString</cs:name>
            <cs:sentinel>false</cs:sentinel>
            <cs:managedID>EAID_18BFBA8D_E3F4_4d8c_9A8F_4429FA54B041</cs:managedID>
            <cs:catalogEntries>
                <cs:CatalogEntry>
                    <cs:name>#primitive-datatypes</cs:name>
                </cs:CatalogEntry>
            </cs:catalogEntries>
            <cs:xsdTypes>
                <cs:XsdType>
                    <cs:name>xs:string</cs:name>
                    <cs:asAttribute>xs:string</cs:asAttribute>
                    <cs:asAttributeDesignation>simpletype</cs:asAttributeDesignation>
                    <cs:primitive>true</cs:primitive>
                </cs:XsdType>
            </cs:xsdTypes>
        </cs:Construct>
        <cs:Construct>
            <cs:name>Integer</cs:name>
            <cs:sentinel>false</cs:sentinel>
            <cs:managedID>EAID_F38912FB_7856_4a9d_AF96_CB2238371C04</cs:managedID>
            <cs:catalogEntries>
                <cs:CatalogEntry>
                    <cs:name>#primitive-datatypes</cs:name>
                </cs:CatalogEntry>
            </cs:catalogEntries>
            <cs:xsdTypes>
                <cs:XsdType>
                    <cs:name>xs:integer</cs:name>
                    <cs:asAttribute>xs:integer</cs:asAttribute>
                    <cs:asAttributeDesignation>simpletype</cs:asAttributeDesignation>
                    <cs:primitive>true</cs:primitive>
                </cs:XsdType>
            </cs:xsdTypes>
        </cs:Construct>
        <cs:Construct>
            <cs:name>Real</cs:name>
            <cs:sentinel>false</cs:sentinel>
            <cs:managedID>EAID_3C4BBF7A_20EC_4a62_A172_F00A6D73FD5E</cs:managedID>
            <cs:catalogEntries>
                <cs:CatalogEntry>
                    <cs:name>#primitive-datatypes</cs:name>
                </cs:CatalogEntry>
            </cs:catalogEntries>
            <cs:xsdTypes>
                <cs:XsdType>
                    <cs:name>xs:real</cs:name>
                    <cs:asAttribute>xs:real</cs:asAttribute>
                    <cs:asAttributeDesignation>simpletype</cs:asAttributeDesignation>
                    <cs:primitive>true</cs:primitive>
                </cs:XsdType>
            </cs:xsdTypes>
        </cs:Construct>
        <cs:Construct>
            <cs:name>Decimal</cs:name>
            <cs:sentinel>false</cs:sentinel>
            <cs:managedID>EAID_4B14AA67_7035_465b_B4A5_AACAB944175E</cs:managedID>
            <cs:catalogEntries>
                <cs:CatalogEntry>
                    <cs:name>#primitive-datatypes</cs:name>
                </cs:CatalogEntry>
            </cs:catalogEntries>
            <cs:xsdTypes>
                <cs:XsdType>
                    <cs:name>xs:decimal</cs:name>
                    <cs:asAttribute>xs:decimal</cs:asAttribute>
                    <cs:asAttributeDesignation>simpletype</cs:asAttributeDesignation>
                    <cs:primitive>true</cs:primitive>
                </cs:XsdType>
            </cs:xsdTypes>
        </cs:Construct>
        <cs:Construct>
            <cs:name>Boolean</cs:name>
            <cs:sentinel>false</cs:sentinel>
            <cs:managedID>EAID_70FBDB70_4B81_46ab_97BB_058195812ECB</cs:managedID>
            <cs:catalogEntries>
                <cs:CatalogEntry>
                    <cs:name>#primitive-datatypes</cs:name>
                </cs:CatalogEntry>
            </cs:catalogEntries>
            <cs:xsdTypes>
                <cs:XsdType>
                    <cs:name>xs:boolean</cs:name>
                    <cs:asAttribute>xs:boolean</cs:asAttribute>
                    <cs:asAttributeDesignation>simpletype</cs:asAttributeDesignation>
                    <cs:primitive>true</cs:primitive>
                </cs:XsdType>
            </cs:xsdTypes>
        </cs:Construct>
        <cs:Construct>
            <cs:name>Date</cs:name>
            <cs:sentinel>false</cs:sentinel>
            <cs:managedID>EAID_3E6F5023_BF71_4da0_8747_0B8D334A8D04</cs:managedID>
            <cs:catalogEntries>
                <cs:CatalogEntry>
                    <cs:name>#primitive-datatypes</cs:name>
                </cs:CatalogEntry>
            </cs:catalogEntries>
            <cs:xsdTypes>
                <cs:XsdType>
                    <cs:name>xs:date</cs:name>
                    <cs:asAttribute>xs:date</cs:asAttribute>
                    <cs:asAttributeDesignation>simpletype</cs:asAttributeDesignation>
                    <cs:primitive>true</cs:primitive>
                </cs:XsdType>
            </cs:xsdTypes>
        </cs:Construct>
        <cs:Construct>
            <cs:name>DateTime</cs:name>
            <cs:sentinel>false</cs:sentinel>
            <cs:managedID>EAID_366435A3_6E41_4add_A833_21873B97D7C7</cs:managedID>
            <cs:catalogEntries>
                <cs:CatalogEntry>
                    <cs:name>#primitive-datatypes</cs:name>
                </cs:CatalogEntry>
            </cs:catalogEntries>
            <cs:xsdTypes>
                <cs:XsdType>
                    <cs:name>xs:dateTime</cs:name>
                    <cs:asAttribute>xs:dateTime</cs:asAttribute>
                    <cs:asAttributeDesignation>simpletype</cs:asAttributeDesignation>
                    <cs:primitive>true</cs:primitive>
                </cs:XsdType>
            </cs:xsdTypes>
        </cs:Construct>
        <cs:Construct>
            <cs:name>Year</cs:name>
            <cs:sentinel>false</cs:sentinel>
            <cs:managedID>EAID_4DA242C6_3972_4f1e_86F0_BBB8046F4BC9</cs:managedID>
            <cs:catalogEntries>
                <cs:CatalogEntry>
                    <cs:name>#primitive-datatypes</cs:name>
                </cs:CatalogEntry>
            </cs:catalogEntries>
            <cs:xsdTypes>
                <cs:XsdType>
                    <cs:name>xs:gYear</cs:name>
                    <cs:asAttribute>xs:gYear</cs:asAttribute>
                    <cs:asAttributeDesignation>simpletype</cs:asAttributeDesignation>
                    <cs:primitive>true</cs:primitive>
                </cs:XsdType>
            </cs:xsdTypes>
        </cs:Construct>
        <cs:Construct>
            <cs:name>Day</cs:name>
            <cs:sentinel>false</cs:sentinel>
            <cs:managedID>EAID_427C0973_E12D_47f8_A326_AACBADEE5AE6</cs:managedID>
            <cs:catalogEntries>
                <cs:CatalogEntry>
                    <cs:name>#primitive-datatypes</cs:name>
                </cs:CatalogEntry>
            </cs:catalogEntries>
            <cs:xsdTypes>
                <cs:XsdType>
                    <cs:name>xs:gDay</cs:name>
                    <cs:asAttribute>xs:gDay</cs:asAttribute>
                    <cs:asAttributeDesignation>simpletype</cs:asAttributeDesignation>
                    <cs:primitive>true</cs:primitive>
                </cs:XsdType>
            </cs:xsdTypes>
        </cs:Construct>
        <cs:Construct>
            <cs:name>Month</cs:name>
            <cs:sentinel>false</cs:sentinel>
            <cs:managedID>EAID_FC8CFD1F_45A2_4507_90DA_82453E61834B</cs:managedID>
            <cs:catalogEntries>
                <cs:CatalogEntry>
                    <cs:name>#primitive-datatypes</cs:name>
                </cs:CatalogEntry>
            </cs:catalogEntries>
            <cs:xsdTypes>
                <cs:XsdType>
                    <cs:name>xs:gMonth</cs:name>
                    <cs:asAttribute>xs:gMonth</cs:asAttribute>
                    <cs:asAttributeDesignation>simpletype</cs:asAttributeDesignation>
                    <cs:primitive>true</cs:primitive>
                </cs:XsdType>
            </cs:xsdTypes>
        </cs:Construct>
        <cs:Construct>
            <cs:name>URI</cs:name>
            <cs:sentinel>false</cs:sentinel>
            <cs:managedID>EAID_DAB6A78C_1FE9_4ecf_9DB3_45B541679D62</cs:managedID>
            <cs:catalogEntries>
                <cs:CatalogEntry>
                    <cs:name>#primitive-datatypes</cs:name>
                </cs:CatalogEntry>
            </cs:catalogEntries>
            <cs:xsdTypes>
                <cs:XsdType>
                    <cs:name>xs:anyURI</cs:name>
                    <cs:asAttribute>xs:anyURI</cs:asAttribute>
                    <cs:asAttributeDesignation>simpletype</cs:asAttributeDesignation>
                    <cs:primitive>true</cs:primitive>
                </cs:XsdType>
            </cs:xsdTypes>
        </cs:Construct>
    </cs:constructs>
</cs:Map>