<?xml version="1.0" encoding="UTF-8"?>
<cs:Map xmlns:xlink="http://www.w3.org/1999/xlink"
    xmlns:cs="http://www.imvertor.org/metamodels/conceptualschemas/model/v20181210"
    xmlns:cs-ref="http://www.imvertor.org/metamodels/conceptualschemas/model-ref/v20181210"
    xmlns:xsi="http://www.w3.org/2001/XMLSchema-instance"
    xmlns:xi="http://www.w3.org/2001/XInclude"
    xsi:schemaLocation="http://www.imvertor.org/metamodels/conceptualschemas/model/v20181210 
    ../../../etc/xsd/ConceptualSchema/root/model/v20181210/ConceptualSchemas_Model_v1_0.xsd">
   
   <cs:id>MIM111KAD</cs:id>
   <cs:namespace>http://www.kadaster.nl/MIM111</cs:namespace>
   <cs:location>http://schemas.kadaster.nl/mim111.xsd</cs:location><!-- TODO --><!-- bogus not used for schema generator -->
   <cs:phase>3</cs:phase>
   <cs:version>1.0.0</cs:version>
   <cs:release>20221101</cs:release>
   <cs:forSchema>
      <cs-ref:ConceptualSchemaRef xlink:href="#MIM111KAD"/>
   </cs:forSchema>
   <cs:owner>Kadaster</cs:owner>
   <cs:constructs>
      <cs:Construct>
         <cs:name>YearMonth</cs:name>
         <cs:sentinel>false</cs:sentinel>
         <cs:managedID>EAID_A69F4EF6_65B9_4a9f_BB90_B6BA3C08CB4D</cs:managedID>
         <cs:catalogEntries>
            <cs:CatalogEntry>
               <cs:name>#primitive-datatypes</cs:name>
            </cs:CatalogEntry>
         </cs:catalogEntries>
         <cs:xsdTypes>
            <cs:XsdType>
               <cs:name>xs:gYearMonth</cs:name>
               <cs:asAttribute>xs:gYearMonth</cs:asAttribute>
               <cs:asAttributeDesignation>simpletype</cs:asAttributeDesignation>
               <cs:primitive>true</cs:primitive>
            </cs:XsdType>
         </cs:xsdTypes>
         <cs:oasTypes>
            <cs:OasType>
               <cs:name>yearMonth</cs:name>
               <cs:primitive>true</cs:primitive>
            </cs:OasType>
         </cs:oasTypes>
      </cs:Construct>
      <cs:Construct>
         <cs:name>Time</cs:name>
         <cs:sentinel>false</cs:sentinel>
         <cs:managedID>EAID_79028B0D_4BB3_434a_9D1A_8D340D810ABE</cs:managedID>
         <cs:catalogEntries>
            <cs:CatalogEntry>
               <cs:name>#primitive-datatypes</cs:name>
            </cs:CatalogEntry>
         </cs:catalogEntries>
         <cs:xsdTypes>
            <cs:XsdType>
               <cs:name>xs:time</cs:name>
               <cs:asAttribute>xs:time</cs:asAttribute>
               <cs:asAttributeDesignation>simpletype</cs:asAttributeDesignation>
               <cs:primitive>true</cs:primitive>
            </cs:XsdType>
         </cs:xsdTypes>
         <cs:oasTypes>
            <cs:OasType>
               <cs:name>time</cs:name>
               <cs:primitive>true</cs:primitive>
            </cs:OasType>
         </cs:oasTypes>
      </cs:Construct>
   </cs:constructs>
   
</cs:Map>