<?xml version="1.0" encoding="UTF-8"?>
<cs:Map xmlns:xlink="http://www.w3.org/1999/xlink"
    xmlns:cs="http://www.imvertor.org/metamodels/conceptualschemas/model/v20181210"
    xmlns:cs-ref="http://www.imvertor.org/metamodels/conceptualschemas/model-ref/v20181210"
    xmlns:xsi="http://www.w3.org/2001/XMLSchema-instance"
    xmlns:xi="http://www.w3.org/2001/XInclude"
    xsi:schemaLocation="http://www.imvertor.org/metamodels/conceptualschemas/model/v20181210 
    ../../../etc/xsd/ConceptualSchema/root/model/v20181210/ConceptualSchemas_Model_v1_0.xsd">
   
    <cs:id>UMLMETA</cs:id>
    <cs:namespace>http://www.geonovum.nl/UML-meta</cs:namespace>
    <cs:location>http://schemas.geonovum.nl/UML-meta.xsd</cs:location><!-- bogus not used for schema generator -->
    <cs:phase>3</cs:phase>
    <cs:version>1.0.0</cs:version>
    <cs:release>20210521</cs:release>
    <cs:forSchema>
        <cs-ref:ConceptualSchemaRef xlink:href="#UMLMETA"/>
    </cs:forSchema>
    <cs:constructs>
        <cs:Construct>
            <cs:name>UMLAssociation</cs:name>
            <cs:sentinel>false</cs:sentinel>
            <cs:catalogEntries>
                <cs:CatalogEntry>
                    <cs:name>(UML) Association</cs:name>
                </cs:CatalogEntry>
            </cs:catalogEntries>
            <cs:xsdTypes>
                <cs:XsdType>
                    <cs:name>UMLAssociation</cs:name>
                </cs:XsdType>
            </cs:xsdTypes>
        </cs:Construct>
        <cs:Construct>
            <cs:name>UMLClass</cs:name>
            <cs:sentinel>false</cs:sentinel>
            <cs:catalogEntries>
                <cs:CatalogEntry>
                    <cs:name>(UML) Class</cs:name>
                </cs:CatalogEntry>
            </cs:catalogEntries>
            <cs:xsdTypes>
                <cs:XsdType>
                    <cs:name>UMLClass</cs:name>
                </cs:XsdType>
            </cs:xsdTypes>
        </cs:Construct>
        <cs:Construct>
            <cs:name>UMLClassifier</cs:name>
            <cs:sentinel>false</cs:sentinel>
            <cs:catalogEntries>
                <cs:CatalogEntry>
                    <cs:name>(UML) Classifier</cs:name>
                </cs:CatalogEntry>
            </cs:catalogEntries>
            <cs:xsdTypes>
                <cs:XsdType>
                    <cs:name>UMLClassifier</cs:name>
                </cs:XsdType>
            </cs:xsdTypes>
        </cs:Construct>
        <cs:Construct>
            <cs:name>UMLConstraint</cs:name>
            <cs:sentinel>false</cs:sentinel>
            <cs:catalogEntries>
                <cs:CatalogEntry>
                    <cs:name>(UML) Constraint</cs:name>
                </cs:CatalogEntry>
            </cs:catalogEntries>
            <cs:xsdTypes>
                <cs:XsdType>
                    <cs:name>UMLConstraint</cs:name>
                </cs:XsdType>
            </cs:xsdTypes>
        </cs:Construct>
        <cs:Construct>
            <cs:name>UMLDatatype</cs:name>
            <cs:sentinel>false</cs:sentinel>
            <cs:catalogEntries>
                <cs:CatalogEntry>
                    <cs:name>(UML) Datatype</cs:name>
                </cs:CatalogEntry>
            </cs:catalogEntries>
            <cs:xsdTypes>
                <cs:XsdType>
                    <cs:name>UMLDatatype</cs:name>
                </cs:XsdType>
            </cs:xsdTypes>
        </cs:Construct>
        <cs:Construct>
            <cs:name>UMLEnumeration</cs:name>
            <cs:sentinel>false</cs:sentinel>
            <cs:catalogEntries>
                <cs:CatalogEntry>
                    <cs:name>(UML) Enumeration</cs:name>
                </cs:CatalogEntry>
            </cs:catalogEntries>
            <cs:xsdTypes>
                <cs:XsdType>
                    <cs:name>UMLEnumeration</cs:name>
                </cs:XsdType>
            </cs:xsdTypes>
        </cs:Construct>
        <cs:Construct>
            <cs:name>UMLEnumerationLiteral</cs:name>
            <cs:sentinel>false</cs:sentinel>
            <cs:catalogEntries>
                <cs:CatalogEntry>
                    <cs:name>(UML) EnumerationLiteral</cs:name>
                </cs:CatalogEntry>
            </cs:catalogEntries>
            <cs:xsdTypes>
                <cs:XsdType>
                    <cs:name>UMLEnumerationLiteral</cs:name>
                </cs:XsdType>
            </cs:xsdTypes>
        </cs:Construct>
        <cs:Construct>
            <cs:name>UMLGeneralization</cs:name>
            <cs:sentinel>false</cs:sentinel>
            <cs:catalogEntries>
                <cs:CatalogEntry>
                    <cs:name>(UML) Generalization</cs:name>
                </cs:CatalogEntry>
            </cs:catalogEntries>
            <cs:xsdTypes>
                <cs:XsdType>
                    <cs:name>UMLGeneralization</cs:name>
                </cs:XsdType>
            </cs:xsdTypes>
        </cs:Construct>
        <cs:Construct>
            <cs:name>UMLPackage</cs:name>
            <cs:sentinel>false</cs:sentinel>
            <cs:catalogEntries>
                <cs:CatalogEntry>
                    <cs:name>(UML) Package</cs:name>
                </cs:CatalogEntry>
            </cs:catalogEntries>
            <cs:xsdTypes>
                <cs:XsdType>
                    <cs:name>UMLPackage</cs:name>
                </cs:XsdType>
            </cs:xsdTypes>
        </cs:Construct>
        <cs:Construct>
            <cs:name>UMLPrimitiveType</cs:name>
            <cs:sentinel>false</cs:sentinel>
            <cs:catalogEntries>
                <cs:CatalogEntry>
                    <cs:name>(UML) PrimitiveType</cs:name>
                </cs:CatalogEntry>
            </cs:catalogEntries>
            <cs:xsdTypes>
                <cs:XsdType>
                    <cs:name>UMLPrimitiveType</cs:name>
                </cs:XsdType>
            </cs:xsdTypes>
        </cs:Construct>
        <cs:Construct>
            <cs:name>UMLProperty</cs:name>
            <cs:sentinel>false</cs:sentinel>
            <cs:catalogEntries>
                <cs:CatalogEntry>
                    <cs:name>(UML) Property</cs:name>
                </cs:CatalogEntry>
            </cs:catalogEntries>
            <cs:xsdTypes>
                <cs:XsdType>
                    <cs:name>UMLProperty</cs:name>
                </cs:XsdType>
            </cs:xsdTypes>
        </cs:Construct>
        <cs:Construct>
            <cs:name>UMLRelation</cs:name>
            <cs:sentinel>false</cs:sentinel>
            <cs:catalogEntries>
                <cs:CatalogEntry>
                    <cs:name>(UML) Relation</cs:name>
                </cs:CatalogEntry>
            </cs:catalogEntries>
            <cs:xsdTypes>
                <cs:XsdType>
                    <cs:name>UMLRelation</cs:name>
                </cs:XsdType>
            </cs:xsdTypes>
        </cs:Construct>
    </cs:constructs>
</cs:Map>